{"domain":"filterest-release-trust-policy/v1","schema_version":1,"signature_type":"ed25519_detached","signatures":[{"key_fingerprint":"33b87fb9373923c2d9fbf65e4b79a7951181402f797dc339c38e8a310e15dab4","signature":"7eaeYWIHR7dGW8+AwKivf6E9ayx8TcvgDB0Hfw30Gtc8z/YqUguBsSha5smxmqlOo8cElByIhgXhk1JfpRwZCA=="},{"key_fingerprint":"6cf2acd9378a94dca8ed64443def72b6dcea229bfc976fb92f8e90340dfb2673","signature":"ss73wDMf/VzK0E/E6QbCkHjswrRtflU9JI5TpCbSxYuVvEdw3G3EB0J/3tlieVTZA4L9mzMJzR/WZBj9uIusCg=="},{"key_fingerprint":"554124820e5296b062bcc1f7fdb6870822df081aaa55c08f440a68c24360a447","signature":"2mGPQMYxEJkfU58iNq6rJSVjfXrOJqniPKRPdcdV5hYEojUJgln38xCC1LPOKouXB6ENFjtZi+lUV26YQp5/AQ=="}]}
