{"domain":"filterest-release-manifest/v1","schema_version":1,"signature_type":"ed25519_detached","signatures":[{"key_fingerprint":"33b87fb9373923c2d9fbf65e4b79a7951181402f797dc339c38e8a310e15dab4","signature":"qyz4QnuqEfHC0uHK9wEBY6m/Gvhy3ABQPEV2JnYbIDo1ckNJXxf3c/URkY/d4u2D+vBr6IquYkChOgW49VitAw=="},{"key_fingerprint":"554124820e5296b062bcc1f7fdb6870822df081aaa55c08f440a68c24360a447","signature":"E+5jVywXmG4fPKMhrwOiTiRv+tR/gH88Ml5QDgJWVggYJYilNqFb1HtoTGjBn8LdzWMkJ1f+sKb3BoQC6vRqCw=="}]}
