{"domain":"filterest-release-manifest/v1","schema_version":1,"signature_type":"ed25519_detached","signatures":[{"key_fingerprint":"6cf2acd9378a94dca8ed64443def72b6dcea229bfc976fb92f8e90340dfb2673","signature":"1xX11doYLCEC5av3Coa4SuUkbpOJ9u2WhpPHmRyYgxB2B9Fq+XM+dMZA/I0DMKCTuZU5nLbT81pV75fbPAW1BQ=="}]}
