{"domain":"filterest-release-manifest/v1","schema_version":1,"signature_type":"ed25519_detached","signatures":[{"key_fingerprint":"33b87fb9373923c2d9fbf65e4b79a7951181402f797dc339c38e8a310e15dab4","signature":"qyz4QnuqEfHC0uHK9wEBY6m/Gvhy3ABQPEV2JnYbIDo1ckNJXxf3c/URkY/d4u2D+vBr6IquYkChOgW49VitAw=="}]}
